{"adapter":{"id":"hmk-daimon-projection","version":"1.0.0"},"author_me_id":"dm:being:v1:AAAAAAAAAAAAAAAAAAAAAAAAAAAAAAAAAAAAAAAAAAA","category":"personal-insight","head":{"event_hash":"fa9714ca506313b210cc90f8da7f3ec2ecb09902ff9b5400c45017557fc32370","event_id":"2b36ce7d-722f-55b9-8161-66cda34b68b5","predecessor_event_id":"d4747655-8c05-5935-810d-aaccb04ed5f7","predecessor_hash":"04912db95412c529e5dcdd57134568842f9a019f3da8460f325cd2558a030371","sequence":3},"idempotency_key":"vector:retract","memory_id":"6ed1c3bd-24d9-513e-9430-41ff147a11c8","operation":"retract","projector":{"id":"matrix:personal-memory-projector","version":"1.0.0"},"request_id":"35feda60-0fb9-5712-86fc-566748a0d5d6","schema":"hmk.daimon-projection.request/v1","source_checkpoint":{"hash":"2ac9e4e65b0f34e262b0977d263eb035e84c8e9fef673e64c5211c9738470655","sequence":3},"source_instance":"matrix:vector-instance","statement":null,"subject_me_id":"dm:being:v1:AAAAAAAAAAAAAAAAAAAAAAAAAAAAAAAAAAAAAAAAAAA","target":{"api_version":"1.0.0","instance_id":"hmk:vector-instance","schema_version":1}}
