{"adapter":{"id":"hmk-daimon-projection","version":"1.0.0"},"author_me_id":"dm:being:v1:AAAAAAAAAAAAAAAAAAAAAAAAAAAAAAAAAAAAAAAAAAA","category":"personal-insight","head":{"event_hash":"04912db95412c529e5dcdd57134568842f9a019f3da8460f325cd2558a030371","event_id":"d4747655-8c05-5935-810d-aaccb04ed5f7","predecessor_event_id":"a9f98b1d-115b-5979-b98d-88b8501667b6","predecessor_hash":"83a637dd23ef611607c69eb5a2674fb858ed22819b20eb448469eb7af3b7da43","sequence":2},"idempotency_key":"vector:advance","memory_id":"6ed1c3bd-24d9-513e-9430-41ff147a11c8","operation":"advance","projector":{"id":"matrix:personal-memory-projector","version":"1.0.0"},"request_id":"0f092ade-0369-55bb-ae7e-315b789952da","schema":"hmk.daimon-projection.request/v1","source_checkpoint":{"hash":"71732bee4ad65d0a6c81e531652cd1326fea5845d90c656c65cb5e7ada433b89","sequence":2},"source_instance":"matrix:vector-instance","statement":{"byte_length":38,"classification":"protected","media_type":"text/plain","sha256":"4902923cb6d9befcee807bf8f87584ce8a803e1255cedbffc5f84eb15cd3f188","text":"The orchard gate now opens at sunrise."},"subject_me_id":"dm:being:v1:AAAAAAAAAAAAAAAAAAAAAAAAAAAAAAAAAAAAAAAAAAA","target":{"api_version":"1.0.0","instance_id":"hmk:vector-instance","schema_version":1}}
