{"adapter":{"id":"hmk-daimon-projection","version":"1.0.0"},"author_me_id":"dm:being:v1:AAAAAAAAAAAAAAAAAAAAAAAAAAAAAAAAAAAAAAAAAAA","category":"personal-insight","head":{"event_hash":"83a637dd23ef611607c69eb5a2674fb858ed22819b20eb448469eb7af3b7da43","event_id":"a9f98b1d-115b-5979-b98d-88b8501667b6","predecessor_event_id":null,"predecessor_hash":null,"sequence":1},"idempotency_key":"vector:project","memory_id":"6ed1c3bd-24d9-513e-9430-41ff147a11c8","operation":"project","projector":{"id":"matrix:personal-memory-projector","version":"1.0.0"},"request_id":"07a93487-ee36-5c92-887a-b0af1457026c","schema":"hmk.daimon-projection.request/v1","source_checkpoint":{"hash":"ebe3f0c9d7397378618fb27ccd9b767fc55112d101c9f1484bff3bae22f60383","sequence":1},"source_instance":"matrix:vector-instance","statement":{"byte_length":31,"classification":"protected","media_type":"text/plain","sha256":"f87db8f88c96dd7ad1cc111e9d6b806a48f3c387f1d59087b2c074d5a7b4b3f0","text":"The orchard gate opens at dawn."},"subject_me_id":"dm:being:v1:AAAAAAAAAAAAAAAAAAAAAAAAAAAAAAAAAAAAAAAAAAA","target":{"api_version":"1.0.0","instance_id":"hmk:vector-instance","schema_version":1}}
